{
  "schemaVersion": 1,
  "id": 14,
  "slug": "temperance",
  "name": {
    "ar": "الاعتدال",
    "en": "Temperance"
  },
  "keywords": [],
  "headline": "الاعتدال والمواءمة",
  "core": {
    "psychology": "يرمز الاعتدال إلى مزج عناصر مختلفة بإيقاع يسمح لها بالعمل معاً. الدافع هو المواءمة لا التسوية التي تمحو الفروق. قوته في التدرج والربط بين الحاجات، وتوتره أن السعي إلى السلام قد يؤجل مواجهة لا يمكن حلها بالتلطيف وحده.",
    "gift": "التوازن والتدرج يظهران في إدارة الانتقال بين مطلبين أو منظورين من دون استنزاف أحدهما. في العمل، يفيد ذلك في التنسيق والوساطة وبناء عملية قابلة للاستمرار. وفي العلاقات، يدعم التفاوض على إيقاع مشترك مع بقاء الاختلاف معلناً.",
    "shadowTrap": "تأجيل الاحتياجات يحدث حين يُسمى الصمت حكمة في كل مرة، أو تُخفف المشكلة حتى يفقد الجميع القدرة على تسميتها. مثال ذلك قبول توزيع غير منصف للأعمال لأن الحديث عنه «سيعكر الجو». الاعتدال لا يساوي إرضاء الجميع على حساب الحقيقة.",
    "growth": "خطوة تأملية: تحديد الحد الأدنى العادل لكل طرف في موضوع مؤجل، وإعلان ما لا يحتمل التأجيل قبل التفاوض على طريقة التنفيذ."
  },
  "chakras": {
    "sahasrara": {
      "psychology": "",
      "shadowTrap": "",
      "bodySymbol": "",
      "practice": ""
    },
    "ajna": {
      "psychology": "",
      "shadowTrap": "",
      "bodySymbol": "",
      "practice": ""
    },
    "vishuddha": {
      "psychology": "",
      "shadowTrap": "",
      "bodySymbol": "",
      "practice": ""
    },
    "anahata": {
      "psychology": "",
      "shadowTrap": "",
      "bodySymbol": "",
      "practice": ""
    },
    "manipura": {
      "psychology": "",
      "shadowTrap": "",
      "bodySymbol": "",
      "practice": ""
    },
    "svadhisthana": {
      "psychology": "",
      "shadowTrap": "",
      "bodySymbol": "",
      "practice": ""
    },
    "muladhara": {
      "psychology": "",
      "shadowTrap": "",
      "bodySymbol": "",
      "practice": ""
    }
  },
  "ancestral": {
    "fatherLine": "",
    "motherLine": ""
  },
  "meta": {
    "status": "review",
    "updated": "2026-10-26",
    "contentStatus": "editorial-core-review",
    "authorship": "aqeeq-original",
    "referenceRuleStatus": "unverified",
    "scopeNote": "صياغة أصلية رمزية للمراجعة؛ لا تمثل قاعدة موثقة للمدرسة ولا حقيقة نفسية مثبتة. الشاكرات وخطوط النسب والمواضع المركبة لم تكتمل في هذا الإصدار."
  }
}
