{
  "schemaVersion": 1,
  "id": 8,
  "slug": "justice",
  "name": {
    "ar": "العدالة",
    "en": "Justice"
  },
  "keywords": [],
  "headline": "العدل والتوازن",
  "core": {
    "psychology": "ترمز العدالة إلى موازنة الفعل بنتيجته، وإلى الحاجة لأن تكون القواعد مفهومة ومتبادلة. دافعها هو استعادة التناسب والإنصاف، وقوتها في رؤية أثر القرار على الأطراف. توترها يظهر حين يختلط الإنصاف بالمثالية أو يتحول الحكم إلى هوية ثابتة: من أخطأ مرة يُختزل كله في خطئه.",
    "gift": "الإنصاف والاتزان يتجليان في سماع الوقائع من أكثر من جهة، وتحديد معيار واحد قبل إصدار الحكم. في العمل، تدعم هذه الطاقة مراجعة العقود والمسؤوليات وتوزيع التقدير. وفي العلاقات، تمنع تراكم الدين العاطفي حين تُناقش التوقعات بوضوح.",
    "shadowTrap": "قسوة الحكم تظهر في محاسبة الذات والآخرين بلا سياق أو في إطالة المرافعة بحثاً عن براءة كاملة. مثال ذلك استدعاء أخطاء قديمة في كل خلاف جديد، فيصبح الحوار محكمة لا مساحة إصلاح. الحذر من التحيز لا يعني إنكار الألم، بل فصل الواقعة عن الإدانة الشاملة.",
    "growth": "قبل الحكم، اكتب الواقعة والقاعدة والنتيجة منفصلة. اسأل ما الإجراء الذي يعيد التوازن ويمنع التكرار، بدلاً من الاكتفاء بالعقاب أو جلد الذات. الإنصاف الناضج يحاسب السلوك ويحفظ إمكان التغيير."
  },
  "chakras": {
    "sahasrara": {
      "psychology": "",
      "shadowTrap": "",
      "bodySymbol": "",
      "practice": ""
    },
    "ajna": {
      "psychology": "",
      "shadowTrap": "",
      "bodySymbol": "",
      "practice": ""
    },
    "vishuddha": {
      "psychology": "",
      "shadowTrap": "",
      "bodySymbol": "",
      "practice": ""
    },
    "anahata": {
      "psychology": "",
      "shadowTrap": "",
      "bodySymbol": "",
      "practice": ""
    },
    "manipura": {
      "psychology": "",
      "shadowTrap": "",
      "bodySymbol": "",
      "practice": ""
    },
    "svadhisthana": {
      "psychology": "",
      "shadowTrap": "",
      "bodySymbol": "",
      "practice": ""
    },
    "muladhara": {
      "psychology": "",
      "shadowTrap": "",
      "bodySymbol": "",
      "practice": ""
    }
  },
  "ancestral": {
    "fatherLine": "",
    "motherLine": ""
  },
  "meta": {
    "status": "review",
    "updated": "2026-10-26",
    "contentStatus": "editorial-core-review",
    "authorship": "aqeeq-original",
    "referenceRuleStatus": "unverified",
    "scopeNote": "صياغة أصلية رمزية للمراجعة؛ لا تمثل قاعدة موثقة للمدرسة ولا حقيقة نفسية مثبتة. الشاكرات وخطوط النسب والمواضع المركبة لم تكتمل في هذا الإصدار."
  }
}
