{
  "schemaVersion": 1,
  "id": 11,
  "slug": "strength",
  "name": {
    "ar": "القوة",
    "en": "Strength"
  },
  "keywords": [],
  "headline": "القوة والاتزان",
  "core": {
    "psychology": "ترمز القوة إلى علاقة واعية مع الشدة: احتواء الدافع بدل كسره أو تركه يقود وحده. قوتها في الصبر والشجاعة الهادئة وحفظ الكرامة عند الاستفزاز. تناقضها أن ضبط النفس قد يُفهم على أنه إخفاء كامل للحاجة، حتى تنفجر الطاقة أو تتحول إلى إنهاك صامت.",
    "gift": "تظهر الشجاعة الهادئة في القدرة على وضع حد دون إذلال، وفي البقاء حاضرًا أثناء محادثة صعبة. في العمل، تمنح ثباتاً أمام الضغط وحماية الفريق من رد فعل متسرع. وفي العلاقة، تدعم المصارحة الحازمة حين تُسمى المشاعر قبل أن تتراكم.",
    "shadowTrap": "الكبت أو الإنهاك ينشآن عندما يتحول الصبر إلى احتمال دائم، أو حين تُعامل الحاجة إلى المساعدة كضعف. مثال ذلك الاستمرار في مسؤولية مرهقة وإظهار الهدوء، ثم الانفجار في موقف صغير. القوة هنا لا تعني غياب الحدود، بل القدرة على التعبير عنها.",
    "growth": "خطوة تأملية: تسمية الانفعال والحد معاً في موقف واحد، وطلب دعم محدد قبل أن يتحول الصبر إلى إنهاك أو انفجار."
  },
  "chakras": {
    "sahasrara": {
      "psychology": "",
      "shadowTrap": "",
      "bodySymbol": "",
      "practice": "",
      "physicsPsychology": "تتجسد الرسالة في استخدام القوة لحماية ما له قيمة دون قسوة أو استنزاف.",
      "energyPsychology": "تُحفظ الطاقة عبر شجاعة هادئة تعترف بالحدود قبل بلوغ الإنهاك.",
      "emotionsPsychology": "يصبح الشعور بالأمان أعمق حين يُسمح بالهشاشة وطلب الدعم، لا حين يُكبت كل انفعال."
    },
    "ajna": {
      "psychology": "",
      "shadowTrap": "",
      "bodySymbol": "",
      "practice": ""
    },
    "vishuddha": {
      "psychology": "",
      "shadowTrap": "",
      "bodySymbol": "",
      "practice": ""
    },
    "anahata": {
      "psychology": "",
      "shadowTrap": "",
      "bodySymbol": "",
      "practice": ""
    },
    "manipura": {
      "psychology": "",
      "shadowTrap": "",
      "bodySymbol": "",
      "practice": ""
    },
    "svadhisthana": {
      "psychology": "",
      "shadowTrap": "",
      "bodySymbol": "",
      "practice": ""
    },
    "muladhara": {
      "psychology": "",
      "shadowTrap": "",
      "bodySymbol": "",
      "practice": ""
    }
  },
  "ancestral": {
    "fatherLine": "",
    "motherLine": ""
  },
  "meta": {
    "status": "review",
    "updated": "2026-10-26",
    "contentStatus": "editorial-core-review",
    "authorship": "aqeeq-original",
    "referenceRuleStatus": "unverified",
    "scopeNote": "صياغة أصلية رمزية للمراجعة؛ لا تمثل قاعدة موثقة للمدرسة ولا حقيقة نفسية مثبتة. الشاكرات وخطوط النسب والمواضع المركبة لم تكتمل في هذا الإصدار. تسمية الأركانا 8 و11 متعارضة بين فهرس الدورة والصفحات الفردية؛ هذه الصياغة تتبع قاموس عقيق المحلي إلى حين اختيار إصدار مرجعي.",
    "arcanaMappingStatus": "source-conflict",
    "chakraContent": {
      "status": "partial-review",
      "authorship": "aqeeq-original",
      "publicTopicLabel": "Sahasrara Mission",
      "referenceRuleStatus": "unverified",
      "bodySymbolStatus": "omitted-no-verified-rule",
      "note": "نصوص رمزية أصلية مرتبطة بهدف الحياة؛ لا تدعي قاعدة موضعية مثبتة ولا تصف عضواً أو عرضاً جسدياً."
    }
  }
}
