{
  "schemaVersion": 1,
  "id": 7,
  "slug": "chariot",
  "name": {
    "ar": "العربة",
    "en": "The Chariot"
  },
  "keywords": [],
  "headline": "الحركة والتقدم",
  "core": {
    "psychology": "",
    "gift": "شجاعة وتوجيه للطاقة",
    "shadowTrap": "استعجال أو صراع",
    "growth": ""
  },
  "chakras": {
    "sahasrara": {
      "psychology": "",
      "shadowTrap": "",
      "bodySymbol": "",
      "practice": ""
    },
    "ajna": {
      "psychology": "",
      "shadowTrap": "",
      "bodySymbol": "",
      "practice": ""
    },
    "vishuddha": {
      "psychology": "",
      "shadowTrap": "",
      "bodySymbol": "",
      "practice": ""
    },
    "anahata": {
      "psychology": "",
      "shadowTrap": "",
      "bodySymbol": "",
      "practice": ""
    },
    "manipura": {
      "psychology": "",
      "shadowTrap": "",
      "bodySymbol": "",
      "practice": ""
    },
    "svadhisthana": {
      "psychology": "",
      "shadowTrap": "",
      "bodySymbol": "",
      "practice": ""
    },
    "muladhara": {
      "psychology": "",
      "shadowTrap": "",
      "bodySymbol": "",
      "practice": ""
    }
  },
  "ancestral": {
    "fatherLine": "",
    "motherLine": ""
  },
  "meta": {
    "status": "draft",
    "updated": "2026-10-25"
  }
}
