{
  "schemaVersion": 1,
  "id": 6,
  "slug": "lovers",
  "name": {
    "ar": "العاشقان",
    "en": "The Lovers"
  },
  "keywords": [],
  "headline": "الاختيار والانسجام",
  "core": {
    "psychology": "يرمز العاشقان إلى الاختيار الذي يكشف ما نعدّه جديراً بالارتباط. الدافع هو طلب التوافق والاعتراف المتبادل، لا مجرد تجنب الوحدة. قوته في قراءة المسافة بين الناس وصنع لغة تقارب؛ وتوتره أن الرغبة في الوئام قد تؤجل قراراً ضرورياً أو تجعل القبول الخارجي بديلاً عن معرفة الرغبة الخاصة.",
    "gift": "التقارب ووضوح القيم يظهران في القدرة على الإصغاء للاختلاف وصياغة اتفاق لا يمحو أحد الطرفين. في العمل، تفيد هذه الطاقة في الشراكة والتفاوض والتعاون الإبداعي. وفي العلاقات، تساعد على بناء مودة واعية حين يصير الاختيار متبادلاً ومبنياً على حقيقة السلوك لا على الصورة المتخيلة.",
    "shadowTrap": "حين يصبح الانسجام غاية مطلقة، تُخفى الاحتياجات لتجنب الخلاف، ثم يظهر الاستياء في صورة انسحاب أو لوم. مثال ذلك الموافقة على قرار مشترك رغم عدم الاقتناع، ثم تحميل الشريك مسؤولية أن «يفهم وحده». التردد هنا ليس نقصاً في الحب، بل نقص في إعلان الموقف.",
    "growth": "خطوة تأملية: كتابة الرغبة والحد غير المقبول قبل التفاوض، ثم مقارنة الاختيار بالسلوك المتكرر والقيم المشتركة لا بصورة مثالية."
  },
  "chakras": {
    "sahasrara": {
      "psychology": "",
      "shadowTrap": "",
      "bodySymbol": "",
      "practice": "",
      "physicsPsychology": "تتكشف الغاية في الاختيار الذي يحفظ القرب والصدق معاً، لا في تجنب كل خلاف.",
      "energyPsychology": "توجه الطاقة قدرتها على التفاوض وصناعة تعاون يحترم الفروق.",
      "emotionsPsychology": "يستقر الشعور حين يُقال الاحتياج بوضوح، ويضطرب حين يصير القبول ثمناً للانتماء."
    },
    "ajna": {
      "psychology": "",
      "shadowTrap": "",
      "bodySymbol": "",
      "practice": "",
      "physicsPsychology": "تتضح الرؤية عند جمع الرغبة والقيمة والعاقبة في قرار واحد، لا عند اختيار ما يرضي الجميع مؤقتاً.",
      "energyPsychology": "تتوزع الطاقة الذهنية بين بدائل ذات معنى؛ ويساعد الاعتراف بكلفة كل خيار على إنهاء التردد.",
      "emotionsPsychology": "تحتاج العاطفة إلى تسمية صريحة لما تريده، كي لا تختلط المحبة بإرضاء الطرف الآخر."
    },
    "vishuddha": {
      "psychology": "",
      "shadowTrap": "",
      "bodySymbol": "",
      "practice": "",
      "physicsPsychology": "توضح طاقة الاختيار ما يراد قوله للشريك أو الفريق، وتمنع المجاملة من حجب القرار الحقيقي.",
      "energyPsychology": "تتوزع القدرة على التعبير بين رغبة الذات ومراعاة الآخر؛ ويساعد التصريح بالتعارض على استعادة الوضوح.",
      "emotionsPsychology": "تخف الحيرة العاطفية حين يُقال الاحتياج كما هو، بدلاً من تقديم موافقة تخفي استياءً لاحقاً."
    },
    "anahata": {
      "psychology": "",
      "shadowTrap": "",
      "bodySymbol": "",
      "practice": "",
      "physicsPsychology": "يقوم الحب على اختيار متجدد وحوار صريح حول الرغبة والالتزام؛ الانجذاب وحده لا يجيب عن سؤال التوافق.",
      "energyPsychology": "تتوازن الحيوية حين يلتقي القرب بالاستقلال وتُسمى الحدود مبكراً، قبل أن تتحول إلى مطالب متبادلة.",
      "emotionsPsychology": "تطمئن المشاعر عندما يكون القبول حراً، لا ثمناً للخوف من الفقد أو وسيلة لكسب رضا الآخر."
    },
    "manipura": {
      "psychology": "",
      "shadowTrap": "",
      "bodySymbol": "",
      "practice": "",
      "physicsPsychology": "يربط العشاق القوة بالاختيار المتبادل: لا يكفي أن يكون القرار جذابًا، بل يجب أن ينسجم مع قيمة يمكن تحمل تبعاتها.",
      "energyPsychology": "تتوزع الطاقة بين رغبة الذات ومصلحة الشراكة، وتحتاج إلى تصريح واضح كي لا تتحول المساومة إلى استنزاف.",
      "emotionsPsychology": "يخف القلق حين لا تُستخدم الحاجة إلى القبول لتسليم القرار كله للطرف الآخر."
    },
    "svadhisthana": {
      "psychology": "",
      "shadowTrap": "",
      "bodySymbol": "",
      "practice": ""
    },
    "muladhara": {
      "psychology": "",
      "shadowTrap": "",
      "bodySymbol": "",
      "practice": ""
    }
  },
  "ancestral": {
    "fatherLine": "",
    "motherLine": ""
  },
  "meta": {
    "status": "review",
    "updated": "2026-10-26",
    "contentStatus": "editorial-core-review",
    "authorship": "aqeeq-original",
    "referenceRuleStatus": "unverified",
    "scopeNote": "صياغة أصلية رمزية للمراجعة؛ لا تمثل قاعدة موثقة للمدرسة ولا حقيقة نفسية مثبتة. الشاكرات وخطوط النسب والمواضع المركبة لم تكتمل في هذا الإصدار.",
    "chakraContent": {
      "sahasrara": {
        "status": "partial-review",
        "authorship": "aqeeq-original",
        "publicTopicLabel": "Sahasrara Mission",
        "referenceRuleStatus": "unverified",
        "bodySymbolStatus": "omitted-no-verified-rule",
        "note": "نصوص رمزية أصلية مرتبطة بهدف الحياة؛ لا تدعي قاعدة موضعية مثبتة ولا تصف عضواً أو عرضاً جسدياً."
      },
      "ajna": {
        "status": "partial-review",
        "authorship": "aqeeq-original",
        "publicTopicLabel": "Ajna Insight",
        "referenceRuleStatus": "unverified",
        "bodySymbolStatus": "omitted-no-verified-rule",
        "note": "نصوص رمزية أصلية للعين الثالثة؛ لا تمثل قاعدة موضعية موثقة ولا تشخيصاً نفسياً أو طبياً."
      },
      "vishuddha": {
        "status": "partial-review",
        "authorship": "aqeeq-original",
        "publicTopicLabel": "Vishuddha Expression",
        "referenceRuleStatus": "unverified",
        "bodySymbolStatus": "omitted-no-verified-rule",
        "note": "نصوص رمزية أصلية للتعبير والتواصل؛ لا تنسب أعراضاً أو قواعد جسدية للمدرسة."
      },
      "anahata": {
        "status": "partial-review",
        "authorship": "aqeeq-original",
        "publicTopicLabel": "Anahata Relationship",
        "referenceRuleStatus": "unverified",
        "bodySymbolStatus": "omitted-no-verified-rule",
        "note": "صياغة رمزية أصلية عن التبادل والقرب والحدود؛ لم تتحقق قاعدة هذا الموضع من المرجع، ولا تتضمن ادعاءً طبياً."
      },
      "manipura": {
        "status": "partial-review",
        "authorship": "aqeeq-original",
        "publicTopicLabel": "Manipura Agency",
        "referenceRuleStatus": "unverified",
        "bodySymbolStatus": "omitted-no-verified-rule",
        "note": "صياغة رمزية أصلية عن الإرادة والموارد والمكانة؛ لم تتحقق قاعدة هذا الموضع من المرجع ولا تتضمن ادعاءً طبياً."
      }
    }
  }
}
