{
  "schemaVersion": 1,
  "id": 9,
  "slug": "hermit",
  "name": {
    "ar": "الناسك",
    "en": "The Hermit"
  },
  "keywords": [],
  "headline": "التأمل والخبرة",
  "core": {
    "psychology": "يرمز الناسك إلى المعرفة التي تنضج بالانسحاب المؤقت من الضجيج. الدافع هو فهم التجربة قبل إعلان معناها، والقوة في الصبر والاستقلال الفكري. توتره أن المسافة التي تحمي التركيز قد تتحول إلى اعتقاد بأن القرب يهدد الحرية، أو أن لا أحد يستطيع فهم ما يجري داخله.",
    "gift": "يظهر التأمل والخبرة في البحث المتأني، وتقديم إجابة مبنية على ملاحظة لا على استعراض. في العمل، يبرع هذا النمط في التحليل والتخصص والكتابة أو الإتقان الحرفي. وفي العلاقة، يمنح صدقاً وعمقاً حين يشرح حاجته للمساحة بدلاً من الاختفاء.",
    "shadowTrap": "العزلة أو الانغلاق يتشكلان عندما يصبح الصمت اختباراً للآخرين أو وسيلة لتجنب طلب المساندة. مثال ذلك الانسحاب من خلاف من دون بيان موعد العودة، فيفهم الطرف الآخر الصمت كرفض. الاستقلال لا يلغي الحاجة الإنسانية إلى تبادل واضح.",
    "growth": "خطوة تأملية: تحديد بداية ونهاية للمسافة المطلوبة، مع مشاركة خلاصة التجربة مع شخص موثوق حتى لا تتحول المعرفة إلى عزلة."
  },
  "chakras": {
    "sahasrara": {
      "psychology": "",
      "shadowTrap": "",
      "bodySymbol": "",
      "practice": ""
    },
    "ajna": {
      "psychology": "",
      "shadowTrap": "",
      "bodySymbol": "",
      "practice": ""
    },
    "vishuddha": {
      "psychology": "",
      "shadowTrap": "",
      "bodySymbol": "",
      "practice": ""
    },
    "anahata": {
      "psychology": "",
      "shadowTrap": "",
      "bodySymbol": "",
      "practice": ""
    },
    "manipura": {
      "psychology": "",
      "shadowTrap": "",
      "bodySymbol": "",
      "practice": ""
    },
    "svadhisthana": {
      "psychology": "",
      "shadowTrap": "",
      "bodySymbol": "",
      "practice": ""
    },
    "muladhara": {
      "psychology": "",
      "shadowTrap": "",
      "bodySymbol": "",
      "practice": ""
    }
  },
  "ancestral": {
    "fatherLine": "",
    "motherLine": ""
  },
  "meta": {
    "status": "review",
    "updated": "2026-10-26",
    "contentStatus": "editorial-core-review",
    "authorship": "aqeeq-original",
    "referenceRuleStatus": "unverified",
    "scopeNote": "صياغة أصلية رمزية للمراجعة؛ لا تمثل قاعدة موثقة للمدرسة ولا حقيقة نفسية مثبتة. الشاكرات وخطوط النسب والمواضع المركبة لم تكتمل في هذا الإصدار."
  }
}
