{
  "schemaVersion": 1,
  "id": 22,
  "slug": "fool",
  "name": {
    "ar": "المجنون",
    "en": "The Fool"
  },
  "keywords": [
    "البدايات الصفرية",
    "البراءة",
    "الحرية المطلقة",
    "الشجاعة في المجهول",
    "القفزة الروحية"
  ],
  "headline": "البدايات المفتوحة",
  "core": {
    "psychology": "يرمز المجنون إلى عتبة بداية مفتوحة وفضول يسبق اكتمال الخريطة، لا إلى غياب العقل. الدافع تجربة الممكن وتخفيف ثقل التعريفات القديمة. قوته في الخفة والابتكار والاستعداد للتعلم من الطريق؛ وتوتره أن الحرية قد تنفصل عن المسؤولية أو أن الحذر يحولها إلى خوف من كل بداية.",
    "gift": "الفضول والتجربة يظهران في الاقتراب من مجال جديد دون ادعاء إتقانه، وفي رؤية بدائل خارج المسار المعتاد. في العمل، يدعم النماذج الأولية والأفكار الجريئة. وفي العلاقات، يمنح مساحة للعفوية واللعب ما دامت الوعود والحدود واضحة.",
    "shadowTrap": "المخاطرة دون تقدير تظهر حين يُتخذ قرار مكلف لمجرد الرغبة في الهروب من الملل، أو حين تُعامل الالتزامات كقيود لا أثر لها على الآخرين. مثال ذلك ترك اتفاق مالي بلا إبلاغ، أو بدء رحلة بلا تقدير الموارد المتاحة.",
    "growth": "خطوة تأملية: تحديد تجربة جديدة صغيرة ذات تكلفة ومدة معلومتين، مع توضيح الالتزام لمن يتأثر بها قبل بدء الطريق."
  },
  "chakras": {
    "sahasrara": {
      "psychology": "",
      "shadowTrap": "",
      "bodySymbol": "",
      "practice": "",
      "physicsPsychology": "تتجسد الغاية في فضول يختبر الممكن ويحترم عواقب البداية.",
      "energyPsychology": "تتجدد الطاقة عبر تجارب صغيرة تفتح معرفة جديدة دون تبديد الموارد.",
      "emotionsPsychology": "ينشأ الأمان من حرية واعية لا من الهرب من كل التزام."
    },
    "ajna": {
      "psychology": "",
      "shadowTrap": "",
      "bodySymbol": "",
      "practice": ""
    },
    "vishuddha": {
      "psychology": "",
      "shadowTrap": "",
      "bodySymbol": "",
      "practice": ""
    },
    "anahata": {
      "psychology": "",
      "shadowTrap": "",
      "bodySymbol": "",
      "practice": ""
    },
    "manipura": {
      "psychology": "",
      "shadowTrap": "",
      "bodySymbol": "",
      "practice": ""
    },
    "svadhisthana": {
      "psychology": "",
      "shadowTrap": "",
      "bodySymbol": "",
      "practice": ""
    },
    "muladhara": {
      "psychology": "",
      "shadowTrap": "",
      "bodySymbol": "",
      "practice": ""
    }
  },
  "ancestral": {
    "fatherLine": "",
    "motherLine": ""
  },
  "meta": {
    "status": "review",
    "updated": "2026-10-26",
    "contentStatus": "editorial-core-review",
    "authorship": "aqeeq-original",
    "referenceRuleStatus": "unverified",
    "scopeNote": "صياغة أصلية رمزية للمراجعة؛ لا تمثل قاعدة موثقة للمدرسة ولا حقيقة نفسية مثبتة. الشاكرات وخطوط النسب والمواضع المركبة لم تكتمل في هذا الإصدار.",
    "chakraContent": {
      "status": "partial-review",
      "authorship": "aqeeq-original",
      "publicTopicLabel": "Sahasrara Mission",
      "referenceRuleStatus": "unverified",
      "bodySymbolStatus": "omitted-no-verified-rule",
      "note": "نصوص رمزية أصلية مرتبطة بهدف الحياة؛ لا تدعي قاعدة موضعية مثبتة ولا تصف عضواً أو عرضاً جسدياً."
    }
  }
}
