{
  "schemaVersion": 1,
  "id": 5,
  "slug": "hierophant",
  "name": {
    "ar": "الكاهن الأعظم",
    "en": "The Hierophant"
  },
  "keywords": [],
  "headline": "التعلم والقيم",
  "core": {
    "psychology": "يرمز الكاهن الأعظم إلى نقل المعرفة داخل تقليد أو جماعة، وإلى السؤال عن القيم التي تجعل الفعل ذا معنى. دافعه هو الانتماء إلى إطار مفهوم ومشاركة ما تعلمه. قوته في التعليم وربط الخبرة بالمبدأ؛ وتوتره حين يخلط بين احترام الحكمة واحتكار الحقيقة أو حين يخشى مخالفة الجماعة.",
    "gift": "تظهر الحكمة في تبسيط فكرة متوارثة دون تسطيحها، وفي بناء لغة مشتركة بين أجيال أو فرق مختلفة. في العمل، يبرز ذلك في التدريب والإرشاد ووضع معايير عادلة. وفي العلاقة، يساعد وضوح القيم على تفاهم مستقر، شرط ألا تتحول المبادئ إلى اختبار دائم للطرف الآخر.",
    "shadowTrap": "قد يصبح الالتزام بالقواعد وسيلة لتجنب مراجعة ما لم يعد يخدم الناس. مثال ذلك رفض أسلوب جديد لمجرد أنه غير مألوف، أو تقديم النصيحة قبل سماع تجربة من يطلبها. هنا يفقد التعليم صلته بالحياة ويتحول إلى وعظ أو حراسة للانتماء.",
    "growth": "خطوة تأملية: تسمية القيمة التي تستحق الحماية، ثم فحص ما إذا كانت الطريقة المعتادة ما زالت تخدمها في الواقع الحالي."
  },
  "chakras": {
    "sahasrara": {
      "psychology": "",
      "shadowTrap": "",
      "bodySymbol": "",
      "practice": ""
    },
    "ajna": {
      "psychology": "",
      "shadowTrap": "",
      "bodySymbol": "",
      "practice": ""
    },
    "vishuddha": {
      "psychology": "",
      "shadowTrap": "",
      "bodySymbol": "",
      "practice": ""
    },
    "anahata": {
      "psychology": "",
      "shadowTrap": "",
      "bodySymbol": "",
      "practice": ""
    },
    "manipura": {
      "psychology": "",
      "shadowTrap": "",
      "bodySymbol": "",
      "practice": ""
    },
    "svadhisthana": {
      "psychology": "",
      "shadowTrap": "",
      "bodySymbol": "",
      "practice": ""
    },
    "muladhara": {
      "psychology": "",
      "shadowTrap": "",
      "bodySymbol": "",
      "practice": ""
    }
  },
  "ancestral": {
    "fatherLine": "",
    "motherLine": ""
  },
  "meta": {
    "status": "review",
    "updated": "2026-10-26",
    "contentStatus": "editorial-core-review",
    "authorship": "aqeeq-original",
    "referenceRuleStatus": "unverified",
    "scopeNote": "صياغة أصلية رمزية للمراجعة؛ لا تمثل قاعدة موثقة للمدرسة ولا حقيقة نفسية مثبتة. الشاكرات وخطوط النسب والمواضع المركبة لم تكتمل في هذا الإصدار."
  }
}
