{
  "schemaVersion": 1,
  "id": 16,
  "slug": "tower",
  "name": {
    "ar": "البرج",
    "en": "The Tower"
  },
  "keywords": [],
  "headline": "التحرر من البنى القديمة",
  "core": {
    "psychology": "يرمز البرج إلى انكشاف بنية لا تصمد أمام الواقع، وإلى الاضطراب الذي يفرض مراجعة الأساس. لا يجعل كل أزمة خيراً تلقائياً؛ لكنه يفتح سؤالاً عما كان هشاً أو مسكوتاً عنه. القوة في مواجهة الحقيقة وإعادة البناء، والتوتر بين رفض الاعتراف وبين هدم كل شيء دفعة واحدة.",
    "gift": "كشف ما يحتاج إلى إصلاح يظهر في الاستعداد لمراجعة افتراض قديم عندما تناقضه الوقائع. في العمل، يدعم الاعتراف بفشل عملية قبل أن يتسع أثرها. وفي العلاقات، قد يحرر الكلام الصريح مساحة لبناء اتفاق واقعي بدلاً من حماية واجهة هشة.",
    "shadowTrap": "هدم بلا خطة قد يكون رد فعل يخلط بين الجزء المختل وكل ما حوله. مثال ذلك الاستقالة أو القطيعة دون فهم المشكلة الأساسية، ثم اكتشاف تكرارها في سياق جديد. وفي الاتجاه الآخر، إنكار الإشارات الواضحة يطيل عمر البنية المتصدعة.",
    "growth": "خطوة تأملية: فصل الجزء الذي تعطل عن الأجزاء الصالحة، وجمع الوقائع قبل اختيار الإصلاح أو الإنهاء بدلاً من القرار من ذروة الانفعال."
  },
  "chakras": {
    "sahasrara": {
      "psychology": "",
      "shadowTrap": "",
      "bodySymbol": "",
      "practice": "",
      "physicsPsychology": "تتجسد الغاية في كشف ما لا يعمل وإعادة بناء أساس أكثر صدقاً.",
      "energyPsychology": "تسترد الطاقة وجهتها عندما يُفصل الخلل المحدد عن كل ما ما زال صالحاً.",
      "emotionsPsychology": "يتراجع الخوف حين تصبح الحقيقة قابلة للتعامل خطوة خطوة."
    },
    "ajna": {
      "psychology": "",
      "shadowTrap": "",
      "bodySymbol": "",
      "practice": "",
      "physicsPsychology": "تختبر البرج متانة الافتراضات وتكشف ما لا ينسجم مع الواقع؛ الرؤية هنا تبدأ من قبول المعلومة المزعجة.",
      "energyPsychology": "تتجه الطاقة إلى إعادة بناء ما ثبت خلله بدلاً من استهلاكها في حماية صورة لم تعد قابلة للدفاع.",
      "emotionsPsychology": "يسمح الاعتراف بالاضطراب بمعالجته تدريجياً؛ وإنكار أثره يطيل الارتباك الداخلي."
    },
    "vishuddha": {
      "psychology": "",
      "shadowTrap": "",
      "bodySymbol": "",
      "practice": ""
    },
    "anahata": {
      "psychology": "",
      "shadowTrap": "",
      "bodySymbol": "",
      "practice": ""
    },
    "manipura": {
      "psychology": "",
      "shadowTrap": "",
      "bodySymbol": "",
      "practice": ""
    },
    "svadhisthana": {
      "psychology": "",
      "shadowTrap": "",
      "bodySymbol": "",
      "practice": ""
    },
    "muladhara": {
      "psychology": "",
      "shadowTrap": "",
      "bodySymbol": "",
      "practice": ""
    }
  },
  "ancestral": {
    "fatherLine": "",
    "motherLine": ""
  },
  "meta": {
    "status": "review",
    "updated": "2026-10-26",
    "contentStatus": "editorial-core-review",
    "authorship": "aqeeq-original",
    "referenceRuleStatus": "unverified",
    "scopeNote": "صياغة أصلية رمزية للمراجعة؛ لا تمثل قاعدة موثقة للمدرسة ولا حقيقة نفسية مثبتة. الشاكرات وخطوط النسب والمواضع المركبة لم تكتمل في هذا الإصدار.",
    "chakraContent": {
      "sahasrara": {
        "status": "partial-review",
        "authorship": "aqeeq-original",
        "publicTopicLabel": "Sahasrara Mission",
        "referenceRuleStatus": "unverified",
        "bodySymbolStatus": "omitted-no-verified-rule",
        "note": "نصوص رمزية أصلية مرتبطة بهدف الحياة؛ لا تدعي قاعدة موضعية مثبتة ولا تصف عضواً أو عرضاً جسدياً."
      },
      "ajna": {
        "status": "partial-review",
        "authorship": "aqeeq-original",
        "publicTopicLabel": "Ajna Insight",
        "referenceRuleStatus": "unverified",
        "bodySymbolStatus": "omitted-no-verified-rule",
        "note": "نصوص رمزية أصلية للعين الثالثة؛ لا تمثل قاعدة موضعية موثقة ولا تشخيصاً نفسياً أو طبياً."
      }
    }
  }
}
