{
  "schemaVersion": 1,
  "id": 2,
  "slug": "high-priestess",
  "name": {
    "ar": "الكاهنة العليا",
    "en": "The High Priestess"
  },
  "keywords": [],
  "headline": "المعرفة والحدس",
  "core": {
    "psychology": "ترمز الكاهنة العليا إلى معرفة تنمو في الصمت وملاحظة ما لم يُقل بعد. دافعها التأملي هو الوصول إلى معنى لا يكشفه الانطباع السريع؛ لذلك تميل إلى الإصغاء، وربط التفاصيل، وترك مساحة للغموض. قوتها discernment وعمق الانتباه، أما توترها فينشأ حين يتحول التحفظ إلى باب مغلق، أو حين تُعامل الحدوس كأنها أدلة مكتملة.",
    "gift": "الإنصات والوعي الداخلي يبدوان في التقاط التناقض بين الكلام والنبرة، وفي تذكر التفاصيل التي يغفل عنها الحوار. في العمل، يفيد ذلك في البحث والتحرير وفهم السياق قبل اتخاذ موقف. وفي العلاقات، يتيح حضوراً هادئاً لا يفرض نفسه، ويمنح الطرف الآخر شعوراً بأنه مسموع.",
    "shadowTrap": "الظل ليس الحدس نفسه، بل استعماله لتجنب السؤال المباشر. قد يفسر الصمت نيابة عن الآخر، أو يحتفظ بمعلومة مهمة خوفاً من أن تُساء قراءتها. مثال ذلك استنتاج الرفض من تأخر الرد ثم الانسحاب دون التحقق، فتتحول الحساسية للسياق إلى عزلة مبنية على افتراض.",
    "growth": "خطوة تأملية: فصل الملاحظة عن التفسير في موقف واحد، ثم صياغة سؤال مباشر يختبر الفهم بدلاً من ترك الصمت يجيب نيابة عن الآخر."
  },
  "chakras": {
    "sahasrara": {
      "psychology": "",
      "shadowTrap": "",
      "bodySymbol": "",
      "practice": "",
      "physicsPsychology": "يتجسد المعنى في البحث المتأني عن المعرفة قبل منحها صفة الحقيقة أو الرسالة.",
      "energyPsychology": "تخدم الطاقة الداخلية الإصغاء للإشارات والسياق، مع إبقاء باب التحقق مفتوحاً.",
      "emotionsPsychology": "يمنح الصمت مساحة للأمان، لكنه لا يعوّض مشاركة الاحتياج أو السؤال الذي ينتظر جواباً."
    },
    "ajna": {
      "psychology": "",
      "shadowTrap": "",
      "bodySymbol": "",
      "practice": "",
      "physicsPsychology": "تلتقط الكاهنة الفروق الدقيقة بين ما قيل وما تُرك ضمنياً، مع تذكير بأن الملاحظة ليست دليلاً نهائياً على نية الآخر.",
      "energyPsychology": "تحتاج القدرة على الإنصات إلى مساحة صامتة، ثم إلى عودة واعية للسؤال والتحقق حتى لا يتحول التأمل إلى افتراض مغلق.",
      "emotionsPsychology": "تمنح المشاعر وقتاً للفهم، لكن الأمان لا يأتي من الكتمان وحده؛ بل من التعبير عما يحتاج إلى توضيح."
    },
    "vishuddha": {
      "psychology": "",
      "shadowTrap": "",
      "bodySymbol": "",
      "practice": "",
      "physicsPsychology": "تختار الكاهنة ما يستحق البوح وما يحتاج خصوصية، مع إبقاء مساحة للسؤال المباشر عندما يهم الفهم المتبادل.",
      "energyPsychology": "تخدم الطاقة الهادئة الإصغاء وصياغة الكلمات بدقة؛ ولا ينبغي أن يصبح الصمت الطريقة الوحيدة لحماية الذات.",
      "emotionsPsychology": "يستقر الشعور عندما يمكن التعبير عن حدّ شخصي دون اعتذار، بدلاً من انتظار أن يفهم الآخر ما لم يُقل."
    },
    "anahata": {
      "psychology": "",
      "shadowTrap": "",
      "bodySymbol": "",
      "practice": ""
    },
    "manipura": {
      "psychology": "",
      "shadowTrap": "",
      "bodySymbol": "",
      "practice": ""
    },
    "svadhisthana": {
      "psychology": "",
      "shadowTrap": "",
      "bodySymbol": "",
      "practice": ""
    },
    "muladhara": {
      "psychology": "",
      "shadowTrap": "",
      "bodySymbol": "",
      "practice": ""
    }
  },
  "ancestral": {
    "fatherLine": "",
    "motherLine": ""
  },
  "meta": {
    "status": "review",
    "updated": "2026-10-26",
    "contentStatus": "editorial-core-review",
    "authorship": "aqeeq-original",
    "referenceRuleStatus": "unverified",
    "scopeNote": "صياغة أصلية رمزية للمراجعة؛ لا تمثل قاعدة موثقة للمدرسة ولا حقيقة نفسية مثبتة. الشاكرات وخطوط النسب والمواضع المركبة لم تكتمل في هذا الإصدار.",
    "chakraContent": {
      "sahasrara": {
        "status": "partial-review",
        "authorship": "aqeeq-original",
        "publicTopicLabel": "Sahasrara Mission",
        "referenceRuleStatus": "unverified",
        "bodySymbolStatus": "omitted-no-verified-rule",
        "note": "نصوص رمزية أصلية مرتبطة بهدف الحياة؛ لا تدعي قاعدة موضعية مثبتة ولا تصف عضواً أو عرضاً جسدياً."
      },
      "ajna": {
        "status": "partial-review",
        "authorship": "aqeeq-original",
        "publicTopicLabel": "Ajna Insight",
        "referenceRuleStatus": "unverified",
        "bodySymbolStatus": "omitted-no-verified-rule",
        "note": "نصوص رمزية أصلية للعين الثالثة؛ لا تمثل قاعدة موضعية موثقة ولا تشخيصاً نفسياً أو طبياً."
      },
      "vishuddha": {
        "status": "partial-review",
        "authorship": "aqeeq-original",
        "publicTopicLabel": "Vishuddha Expression",
        "referenceRuleStatus": "unverified",
        "bodySymbolStatus": "omitted-no-verified-rule",
        "note": "نصوص رمزية أصلية للتعبير والتواصل؛ لا تنسب أعراضاً أو قواعد جسدية للمدرسة."
      }
    }
  }
}
