{
  "schemaVersion": 1,
  "id": 12,
  "slug": "hanged-man",
  "name": {
    "ar": "المعلّق",
    "en": "The Hanged Man"
  },
  "keywords": [],
  "headline": "تغيير المنظور",
  "core": {
    "psychology": "يرمز المعلّق إلى التوقف الذي يغيّر زاوية الرؤية، لا إلى تعطيل الحياة بلا نهاية. دافعه فهم الثمن والمعنى قبل الحركة. قوته في احتمال التعليق مؤقتاً ومراجعة الافتراضات؛ وتوتره أن الانتظار قد يصبح هوية أو تضحية يطلب مقابلها تقديراً لا يصرّح به.",
    "gift": "التأني ورؤية الزاوية الأخرى يظهران عند إعادة تفسير موقف بعد سماع الطرف المقابل، أو عند قبول خسارة صغيرة تمنع ضرراً أكبر. في العمل، تساعد هذه السمة على مراجعة خطة غير مجدية. وفي العلاقات، تمنح فرصة للتراجع عن رد فوري واستيعاب السياق.",
    "shadowTrap": "تعليق القرار يظهر حين يُنتظر يقين كامل لا توفره الحياة، أو حين تُقدَّم التضحية كدليل حب ثم تتراكم المرارة. مثال ذلك البقاء في اتفاق غير عادل بحجة «الوقت سيحلّه» دون طرح شروط واضحة. الصبر يصبح تعطيلًا حين لا يقود إلى فهم أو قرار.",
    "growth": "خطوة تأملية: تحديد المعلومة التي تنهي الانتظار وموعد إعادة التقييم، ثم التمييز بين تضحية مختارة وتنازل ينتظر اعترافاً غير معلن."
  },
  "chakras": {
    "sahasrara": {
      "psychology": "",
      "shadowTrap": "",
      "bodySymbol": "",
      "practice": "",
      "physicsPsychology": "تتضح الغاية حين يفتح التوقف المؤقت زاوية جديدة تقود إلى اختيار أوضح.",
      "energyPsychology": "تستعيد الطاقة معناها عبر احتمال الغموض مدة محدودة لا عبر تأجيل بلا نهاية.",
      "emotionsPsychology": "يخف ثقل الانتظار عندما تُعرف الحاجة التي لم تُسمَّ بعد."
    },
    "ajna": {
      "psychology": "",
      "shadowTrap": "",
      "bodySymbol": "",
      "practice": "",
      "physicsPsychology": "يعيد المعلّق النظر في الفرضية من زاوية مختلفة، مع التمييز بين التريث الذي يكشف معنى والتعطيل الذي يؤجل المواجهة.",
      "energyPsychology": "قد يحمل التوقف فائدة ذهنية حين يغيّر طريقة الفهم، لكنه يفقدها إذا تحول إلى انتظار لا ينتهي.",
      "emotionsPsychology": "تحتاج المشاعر إلى الاعتراف بما يُضحّى به؛ فالمعنى لا يمحو الحاجة إلى حدود متبادلة."
    },
    "vishuddha": {
      "psychology": "",
      "shadowTrap": "",
      "bodySymbol": "",
      "practice": "",
      "physicsPsychology": "يرى المعلّق قيمة التوقف قبل الرد، لكنه يعود للكلام عندما يصبح الصمت تأجيلاً لحدّ أو حقيقة لازمة.",
      "energyPsychology": "قد يعيد الإصغاء صياغة الرسالة من زاوية أوسع؛ أما الانتظار بلا غاية فيستنزف قابلية التعبير.",
      "emotionsPsychology": "يشعر الداخل بالارتياح عندما يشرح ما يقدمه وما لا يستطيع تقديمه، بدلاً من التضحية الصامتة."
    },
    "anahata": {
      "psychology": "",
      "shadowTrap": "",
      "bodySymbol": "",
      "practice": "",
      "physicsPsychology": "يكشف التوقف إن كان العطاء اختياراً حراً أم دوراً مفروضاً؛ المحبة لا تكتمل بتأجيل الذات بلا نهاية.",
      "energyPsychology": "تحتاج طاقة القلب إلى تبادل يسمح بالاستقبال كما يسمح بالعطاء، لا إلى التضحية التي لا تعلن حاجتها.",
      "emotionsPsychology": "يستعيد الداخل توازنه عندما يطلب مقابلاً عادلاً أو يرفض ما يستنزفه، من دون إخفاء ذلك وراء الصبر."
    },
    "manipura": {
      "psychology": "",
      "shadowTrap": "",
      "bodySymbol": "",
      "practice": "",
      "physicsPsychology": "يختبر المعلّق قدرته حين يتوقف عن ربط قيمته بسرعة النتائج؛ التنازل الواعي عن السيطرة يكشف زاوية لم يكن يراها.",
      "energyPsychology": "تتحول الطاقة من الدفع القسري إلى إعادة تقييم الأولويات، لا إلى تضحية مفتوحة بلا موعد أو غاية.",
      "emotionsPsychology": "يحتاج الداخل إلى الاعتراف بأن الانتظار مؤلم، وأن هذا الألم لا يبرر إخفاء الاحتياج عن الآخرين."
    },
    "svadhisthana": {
      "psychology": "",
      "shadowTrap": "",
      "bodySymbol": "",
      "practice": ""
    },
    "muladhara": {
      "psychology": "",
      "shadowTrap": "",
      "bodySymbol": "",
      "practice": ""
    }
  },
  "ancestral": {
    "fatherLine": "",
    "motherLine": ""
  },
  "meta": {
    "status": "review",
    "updated": "2026-10-26",
    "contentStatus": "editorial-core-review",
    "authorship": "aqeeq-original",
    "referenceRuleStatus": "unverified",
    "scopeNote": "صياغة أصلية رمزية للمراجعة؛ لا تمثل قاعدة موثقة للمدرسة ولا حقيقة نفسية مثبتة. الشاكرات وخطوط النسب والمواضع المركبة لم تكتمل في هذا الإصدار.",
    "chakraContent": {
      "sahasrara": {
        "status": "partial-review",
        "authorship": "aqeeq-original",
        "publicTopicLabel": "Sahasrara Mission",
        "referenceRuleStatus": "unverified",
        "bodySymbolStatus": "omitted-no-verified-rule",
        "note": "نصوص رمزية أصلية مرتبطة بهدف الحياة؛ لا تدعي قاعدة موضعية مثبتة ولا تصف عضواً أو عرضاً جسدياً."
      },
      "ajna": {
        "status": "partial-review",
        "authorship": "aqeeq-original",
        "publicTopicLabel": "Ajna Insight",
        "referenceRuleStatus": "unverified",
        "bodySymbolStatus": "omitted-no-verified-rule",
        "note": "نصوص رمزية أصلية للعين الثالثة؛ لا تمثل قاعدة موضعية موثقة ولا تشخيصاً نفسياً أو طبياً."
      },
      "vishuddha": {
        "status": "partial-review",
        "authorship": "aqeeq-original",
        "publicTopicLabel": "Vishuddha Expression",
        "referenceRuleStatus": "unverified",
        "bodySymbolStatus": "omitted-no-verified-rule",
        "note": "نصوص رمزية أصلية للتعبير والتواصل؛ لا تنسب أعراضاً أو قواعد جسدية للمدرسة."
      },
      "anahata": {
        "status": "partial-review",
        "authorship": "aqeeq-original",
        "publicTopicLabel": "Anahata Relationship",
        "referenceRuleStatus": "unverified",
        "bodySymbolStatus": "omitted-no-verified-rule",
        "note": "صياغة رمزية أصلية عن التبادل والقرب والحدود؛ لم تتحقق قاعدة هذا الموضع من المرجع، ولا تتضمن ادعاءً طبياً."
      },
      "manipura": {
        "status": "partial-review",
        "authorship": "aqeeq-original",
        "publicTopicLabel": "Manipura Agency",
        "referenceRuleStatus": "unverified",
        "bodySymbolStatus": "omitted-no-verified-rule",
        "note": "صياغة رمزية أصلية عن الإرادة والموارد والمكانة؛ لم تتحقق قاعدة هذا الموضع من المرجع ولا تتضمن ادعاءً طبياً."
      }
    }
  }
}
