{
  "schemaVersion": 1,
  "id": 20,
  "slug": "judgement",
  "name": {
    "ar": "النداء (الحُكم)",
    "en": "Judgement"
  },
  "keywords": [
    "الصحوة",
    "التحرر من أعباء الماضي",
    "الكارما العائلية",
    "الولادة الجديدة"
  ],
  "headline": "المراجعة والنداء الداخلي",
  "core": {
    "psychology": "يرمز النداء، المسمى الحكم في التاروت، إلى مراجعة الماضي والإنصات لما يستدعي استجابة جديدة؛ لا إلى حكم نهائي على قيمة الإنسان. الدافع هو جمع الخبرة في معنى ومسؤولية. قوته في التعلم وإعادة فتح مسار مؤجل، وتوتره بين التوبة الناضجة ولوم الذات الذي لا ينتج إصلاحاً.",
    "gift": "تعلم الماضي يظهر في القدرة على الاعتراف بنمط سابق من دون إنكار أثره أو اختزال النفس فيه. في العمل، يدعم نقل الدروس بين المراحل وتصحيح أخطاء متكررة. وفي العلاقات، يتيح اعتذاراً محدداً يتبعه سلوك مختلف، لا مجرد تبرير أو جلد ذات.",
    "shadowTrap": "لوم الذات يظهر حين تُعاد المحاكمة بلا نهاية، أو يُطلب الغفران لإسكات النقاش قبل إصلاح الأثر. مثال ذلك تكرار «أنا سيئ» بدلاً من سؤال المتضرر عما يحتاجه الآن. الاستدعاء للمراجعة ليس دعوة للعار، بل للجواب العملي.",
    "growth": "خطوة تأملية: استخراج درس واحد من تجربة سابقة وتحديد سلوك متغير وأثر يحتاج إلى إصلاح، مع جعل الإصلاح عملياً لا عقاباً ذاتياً."
  },
  "chakras": {
    "sahasrara": {
      "psychology": "",
      "shadowTrap": "",
      "bodySymbol": "",
      "practice": "",
      "physicsPsychology": "تتكشف الغاية في مراجعة الخبرة وتحويل الندم إلى استجابة مسؤولة.",
      "energyPsychology": "تستعيد الطاقة قوتها عندما يصير الماضي معلومة للتعلم لا محكمة متكررة.",
      "emotionsPsychology": "يخف ثقل الذنب عندما يتبعه إصلاح ملموس وحدود جديدة."
    },
    "ajna": {
      "psychology": "",
      "shadowTrap": "",
      "bodySymbol": "",
      "practice": "",
      "physicsPsychology": "يراجع الحساب الماضي بحثاً عن الدرس والمسؤولية، ويفصل بين ما يمكن إصلاحه وما لا يفيد لوم الذات عليه.",
      "energyPsychology": "تستعيد الطاقة وجهتها حين تتحول الخبرة إلى موقف جديد، لا إلى إعادة محاكمة للقرار القديم.",
      "emotionsPsychology": "يخف ثقل الندم عندما يصاحبه اعتذار أو إصلاح مناسب، ثم السماح للنفس بالمضي دون إنكار ما حدث."
    },
    "vishuddha": {
      "psychology": "",
      "shadowTrap": "",
      "bodySymbol": "",
      "practice": ""
    },
    "anahata": {
      "psychology": "",
      "shadowTrap": "",
      "bodySymbol": "",
      "practice": ""
    },
    "manipura": {
      "psychology": "",
      "shadowTrap": "",
      "bodySymbol": "",
      "practice": ""
    },
    "svadhisthana": {
      "psychology": "",
      "shadowTrap": "",
      "bodySymbol": "",
      "practice": ""
    },
    "muladhara": {
      "psychology": "",
      "shadowTrap": "",
      "bodySymbol": "",
      "practice": ""
    }
  },
  "ancestral": {
    "fatherLine": "",
    "motherLine": ""
  },
  "meta": {
    "status": "review",
    "updated": "2026-10-26",
    "contentStatus": "editorial-core-review",
    "authorship": "aqeeq-original",
    "referenceRuleStatus": "unverified",
    "scopeNote": "صياغة أصلية رمزية للمراجعة؛ لا تمثل قاعدة موثقة للمدرسة ولا حقيقة نفسية مثبتة. الشاكرات وخطوط النسب والمواضع المركبة لم تكتمل في هذا الإصدار.",
    "chakraContent": {
      "sahasrara": {
        "status": "partial-review",
        "authorship": "aqeeq-original",
        "publicTopicLabel": "Sahasrara Mission",
        "referenceRuleStatus": "unverified",
        "bodySymbolStatus": "omitted-no-verified-rule",
        "note": "نصوص رمزية أصلية مرتبطة بهدف الحياة؛ لا تدعي قاعدة موضعية مثبتة ولا تصف عضواً أو عرضاً جسدياً."
      },
      "ajna": {
        "status": "partial-review",
        "authorship": "aqeeq-original",
        "publicTopicLabel": "Ajna Insight",
        "referenceRuleStatus": "unverified",
        "bodySymbolStatus": "omitted-no-verified-rule",
        "note": "نصوص رمزية أصلية للعين الثالثة؛ لا تمثل قاعدة موضعية موثقة ولا تشخيصاً نفسياً أو طبياً."
      }
    }
  }
}
