{
  "schemaVersion": 1,
  "id": 15,
  "slug": "devil",
  "name": {
    "ar": "الشيطان",
    "en": "The Devil"
  },
  "keywords": [],
  "headline": "الاختيار الواعي",
  "core": {
    "psychology": "يرمز الشيطان إلى التعلق بما يمنح لذة أو قوة أو أماناً مع ثمن غير معلن. لا يعني حكماً أخلاقياً على الشخص ولا كياناً حرفياً. الدافع هو اختبار الرغبة وحدودها؛ والقوة في كشف ما يجذب الانتباه، بينما التوتر أن تتحول الرغبة إلى تبعية أو أن يُدان الاحتياج بدلاً من فهمه.",
    "gift": "ملاحظة التعلق تسمح برؤية الصفقة التي يعقدها المرء مع نفسه: ما الذي يكسبه الآن، وما الذي يخسره لاحقاً؟ في العمل، تكشف علاقة السلطة بالمكافأة. وفي العلاقات، تساعد على تمييز الانجذاب الصادق من الخوف من الوحدة أو الحاجة إلى التحكم.",
    "shadowTrap": "التعلق أو الإفراط يظهران في تكرار سلوك رغم معرفة كلفته، أو في تبرير تجاوز الحدود باسم الشغف. مثال ذلك قبول علاقة متقلبة لأنها تمنح لحظات قرب شديدة، مع تجاهل نمط الأذى المتكرر. الرمز يدعو للفحص لا للوصم.",
    "growth": "خطوة تأملية: رسم المكسب القريب والثمن المتكرر لعلاقة أو عادة، ثم وضع حد قابل للتطبيق وطلب مساندة مناسبة عند الحاجة."
  },
  "chakras": {
    "sahasrara": {
      "psychology": "",
      "shadowTrap": "",
      "bodySymbol": "",
      "practice": "",
      "physicsPsychology": "تظهر الرسالة في رؤية الرغبة والتعلق بوضوح واختيار ما لا يسلب الحرية.",
      "energyPsychology": "تتجه الطاقة إلى ما يمنحها قوة حقيقية بدلاً من الدوران حول مكافأة قصيرة الأمد.",
      "emotionsPsychology": "يخف الصراع الداخلي حين يُفهم الاحتياج بلا وصم وتُراجع كلفته الواقعية."
    },
    "ajna": {
      "psychology": "",
      "shadowTrap": "",
      "bodySymbol": "",
      "practice": ""
    },
    "vishuddha": {
      "psychology": "",
      "shadowTrap": "",
      "bodySymbol": "",
      "practice": ""
    },
    "anahata": {
      "psychology": "",
      "shadowTrap": "",
      "bodySymbol": "",
      "practice": ""
    },
    "manipura": {
      "psychology": "",
      "shadowTrap": "",
      "bodySymbol": "",
      "practice": ""
    },
    "svadhisthana": {
      "psychology": "",
      "shadowTrap": "",
      "bodySymbol": "",
      "practice": ""
    },
    "muladhara": {
      "psychology": "",
      "shadowTrap": "",
      "bodySymbol": "",
      "practice": ""
    }
  },
  "ancestral": {
    "fatherLine": "",
    "motherLine": ""
  },
  "meta": {
    "status": "review",
    "updated": "2026-10-26",
    "contentStatus": "editorial-core-review",
    "authorship": "aqeeq-original",
    "referenceRuleStatus": "unverified",
    "scopeNote": "صياغة أصلية رمزية للمراجعة؛ لا تمثل قاعدة موثقة للمدرسة ولا حقيقة نفسية مثبتة. الشاكرات وخطوط النسب والمواضع المركبة لم تكتمل في هذا الإصدار.",
    "chakraContent": {
      "status": "partial-review",
      "authorship": "aqeeq-original",
      "publicTopicLabel": "Sahasrara Mission",
      "referenceRuleStatus": "unverified",
      "bodySymbolStatus": "omitted-no-verified-rule",
      "note": "نصوص رمزية أصلية مرتبطة بهدف الحياة؛ لا تدعي قاعدة موضعية مثبتة ولا تصف عضواً أو عرضاً جسدياً."
    }
  }
}
