{
  "schemaVersion": 1,
  "id": 18,
  "slug": "moon",
  "name": {
    "ar": "القمر",
    "en": "The Moon"
  },
  "keywords": [
    "العقل الباطن",
    "الأوهام",
    "الخوف العميق",
    "الأحلام والحدس"
  ],
  "headline": "الحدس والمشاعر",
  "core": {
    "psychology": "يرمز القمر إلى عالم الانطباعات والمخاوف والخيال حين تختلط الإشارات بالاستنتاجات. الدافع البحث عن الأمان داخل ما لم يتضح بعد. قوته في الحساسية للجو النفسي والقدرة على تخيل احتمالات متعددة؛ وتوتره أن يملأ الغموض بسردية تبدو يقينية.",
    "gift": "الخيال والتعاطف يظهران في فهم المشاعر غير المنطوقة ورؤية أكثر من تفسير للمشهد. في الإبداع، يفتح ذلك صوراً ومعاني جديدة. وفي العلاقة، يساعد على ملاحظة القلق قبل أن يصير اتهاماً، إذا فُصل الشعور عن الدليل.",
    "shadowTrap": "الضبابية أو الإسقاط يظهران عندما تُعامل المخاوف كوقائع أو يُنسب للآخر قصد لم يصرح به. مثال ذلك قراءة رسالة مقتضبة كرفض قاطع، ثم الرد على ذلك الرفض المتخيل. الحساسية لا تعني أن كل استنتاج دقيق.",
    "growth": "خطوة تأملية: تسمية الشعور أولاً ثم كتابة ما هو معلوم وما هو متوقع، وطلب توضيح من المصدر قبل بناء قصة كاملة."
  },
  "chakras": {
    "sahasrara": {
      "psychology": "",
      "shadowTrap": "",
      "bodySymbol": "",
      "practice": "",
      "physicsPsychology": "تُبنى الغاية عبر الإصغاء للخيال والمشاعر دون مساواتها بالدليل.",
      "energyPsychology": "تحتاج الطاقة إلى تمييز ما تعرفه مباشرة عما أضافه القلق إلى الصورة.",
      "emotionsPsychology": "يمنح الاعتراف بالغموض طمأنينة أكثر من اختراع يقين سريع."
    },
    "ajna": {
      "psychology": "",
      "shadowTrap": "",
      "bodySymbol": "",
      "practice": "",
      "physicsPsychology": "تلتقط القمرية الصور والانطباعات الغامضة، وتحتاج إلى فصل ما شوهد فعلاً عما أضافه الخوف أو التوقع.",
      "energyPsychology": "تتذبذب الطاقة الذهنية عندما تتزاحم الاحتمالات؛ وتستعيد اتزانها عبر الإضاءة والتحقق لا عبر يقين متسرع.",
      "emotionsPsychology": "تُعامل المشاعر كإشارات جديرة بالإصغاء، لا كبرهان منفرد على ما ينويه الآخرون."
    },
    "vishuddha": {
      "psychology": "",
      "shadowTrap": "",
      "bodySymbol": "",
      "practice": ""
    },
    "anahata": {
      "psychology": "",
      "shadowTrap": "",
      "bodySymbol": "",
      "practice": ""
    },
    "manipura": {
      "psychology": "",
      "shadowTrap": "",
      "bodySymbol": "",
      "practice": ""
    },
    "svadhisthana": {
      "psychology": "",
      "shadowTrap": "",
      "bodySymbol": "",
      "practice": ""
    },
    "muladhara": {
      "psychology": "",
      "shadowTrap": "",
      "bodySymbol": "",
      "practice": ""
    }
  },
  "ancestral": {
    "fatherLine": "",
    "motherLine": ""
  },
  "meta": {
    "status": "review",
    "updated": "2026-10-26",
    "contentStatus": "editorial-core-review",
    "authorship": "aqeeq-original",
    "referenceRuleStatus": "unverified",
    "scopeNote": "صياغة أصلية رمزية للمراجعة؛ لا تمثل قاعدة موثقة للمدرسة ولا حقيقة نفسية مثبتة. الشاكرات وخطوط النسب والمواضع المركبة لم تكتمل في هذا الإصدار.",
    "chakraContent": {
      "sahasrara": {
        "status": "partial-review",
        "authorship": "aqeeq-original",
        "publicTopicLabel": "Sahasrara Mission",
        "referenceRuleStatus": "unverified",
        "bodySymbolStatus": "omitted-no-verified-rule",
        "note": "نصوص رمزية أصلية مرتبطة بهدف الحياة؛ لا تدعي قاعدة موضعية مثبتة ولا تصف عضواً أو عرضاً جسدياً."
      },
      "ajna": {
        "status": "partial-review",
        "authorship": "aqeeq-original",
        "publicTopicLabel": "Ajna Insight",
        "referenceRuleStatus": "unverified",
        "bodySymbolStatus": "omitted-no-verified-rule",
        "note": "نصوص رمزية أصلية للعين الثالثة؛ لا تمثل قاعدة موضعية موثقة ولا تشخيصاً نفسياً أو طبياً."
      }
    }
  }
}
